<?xml version="1.0" encoding="utf-8" standalone="yes"?>
<SchedulingPeriod ID="sprint01" xmlns:xsi="http://www.w3.org/2001/XMLSchema-instance" xsi:noNamespaceSchemaLocation="competition.xsd">
  <CourseTypes>
    <Course ID="00000">
      <StartTime>08:00:00</StartTime>
      <EndTime>09:50:00</EndTime>
      <Dept>CHEM</Dept>
      <Crs>124A</Crs>
      <Sec>001</Sec>
      <Bldg>BL</Bldg>
      <Rm>1165</Rm>
    </Course>
    <Course ID="00001">
      <StartTime>10:00:00</StartTime>
      <EndTime>11:50:00</EndTime>
      <Dept>CHEM</Dept>
      <Crs>124A</Crs>
      <Sec>001</Sec>
      <Bldg>BL</Bldg>
      <Rm>1165</Rm>
    </Course>
    <Course ID="00002">
      <StartTime>12:00:00</StartTime>
      <EndTime>13:50:00</EndTime>
      <Dept>CHEM</Dept>
      <Crs>124A</Crs>
      <Sec>001</Sec>
      <Bldg>BL</Bldg>
      <Rm>1165</Rm>
    </Course>
    <Course ID="00003">
      <StartTime>14:00:00</StartTime>
      <EndTime>15:50:00</EndTime>
      <Dept>CHEM</Dept>
      <Crs>124A</Crs>
      <Sec>001</Sec>
      <Bldg>BL</Bldg>
      <Rm>1165</Rm>
    </Course>
    <Course ID="00004">
      <StartTime>14:00:00</StartTime>
      <EndTime>15:50:00</EndTime>
      <Dept>CHEM</Dept>
      <Crs>124A</Crs>
      <Sec>001</Sec>
      <Bldg>BL</Bldg>
      <Rm>1165</Rm>
    </Course>
    <Course ID="00005">
      <StartTime>14:00:00</StartTime>
      <EndTime>15:50:00</EndTime>
      <Dept>CHEM</Dept>
      <Crs>124A</Crs>
      <Sec>001</Sec>
      <Bldg>BL</Bldg>
      <Rm>1165</Rm>
    </Course>
    <Course ID="00006">
      <StartTime>14:00:00</StartTime>
      <EndTime>15:50:00</EndTime>
      <Dept>CHEM</Dept>
      <Crs>124A</Crs>
      <Sec>001</Sec>
      <Bldg>BL</Bldg>
      <Rm>1165</Rm>
    </Course>
  </CourseTypes>
  <Coordinators>
      <Coordinator ID="0">
        <Name>Senator Palpatine</Name>
        <Email>palp@republic.gov</Email>
      </Coordinator>
      <Coordinator ID="1">
        <Name>Senator Palpatine</Name>
        <Email>palp@republic.gov</Email>
      </Coordinator>
  </Coordinators>
  <CoordinatorToCourseType>
      <Mapping>
          <CoordinatorId>0</CoordinatorId>
          <CourseTypeId>00000</CourseTypeId>
      </Mapping>
      <Mapping>
          <CoordinatorId>0</CoordinatorId>
          <CourseTypeId>00001</CourseTypeId>
      </Mapping>
  </CoordinatorToCourseType>
  <Contracts>
    <Contract ID="0">
      <Description>Standard TA Contract</Description>
      <MaxNumAssignments on="1" weight="1">2</MaxNumAssignments>
      <MinNumAssignments on="1" weight="1">1</MinNumAssignments>
    </Contract>
  </Contracts>
  <Tas>
    <Ta ID="0">
      <ContractID>0</ContractID>
      <Name>Furlow, Scott</Name>
      <Email>temp@siue.edu</Email>
    </Ta>
    <Ta ID="1">
      <ContractID>0</ContractID>
      <Name>Peterson, Luke</Name>
      <Email>temp@siue.edu</Email>
    </Ta>
    <Ta ID="2">
      <ContractID>0</ContractID>
      <Name>Hooper, Alex</Name>
      <Email>temp@siue.edu</Email>
    </Ta>
    <Ta ID="3">
      <ContractID>0</ContractID>
      <Name>Jones, Myron</Name>
      <Email>temp@siue.edu</Email>
    </Ta>
    <Ta ID="4">
      <ContractID>0</ContractID>
      <Name>Bouvier, Dennis</Name>
      <Email>temp@siue.edu</Email>
    </Ta>
    <Ta ID="5">
      <ContractID>0</ContractID>
      <Name>White, William</Name>
      <Email>temp@siue.edu</Email>
    </Ta>
    <Ta ID="6">
      <ContractID>0</ContractID>
      <Name>Crk, Igor</Name>
      <Email>temp@siue.edu</Email>
    </Ta>
    <Ta ID="7">
      <ContractID>0</ContractID>
      <Name>Yu, William</Name>
      <Email>apple</Email>
    </Ta>
    <Ta ID="8">
      <ContractID>0</ContractID>
      <Name>Mayer, Gary</Name>
      <Email>temp@siue.edu</Email>
    </Ta>
    <Ta ID="9">
      <ContractID>0</ContractID>
      <Name>Gamage, Thosita</Name>
      <Email>temp@siue.edu</Email>
    </Ta>
  </Tas>
  <CoverRequirements>
      <CourseCover>
          <Course>00000</Course>
          <Preferred>2</Preferred>
          <Days>
              <Day>Monday</Day>
              <Day>Tuesday</Day>
          </Days>
      </CourseCover>
      <CourseCover>
          <Course>00001</Course>
          <Preferred>1</Preferred>
          <Days>
              <Day>Monday</Day>
          </Days>
      </CourseCover>
      <CourseCover>
          <Course>00002</Course>
          <Preferred>1</Preferred>
          <Days>
              <Day>Wednesday</Day>
          </Days>
      </CourseCover>
      <CourseCover>
          <Course>00003</Course>
          <Preferred>1</Preferred>
          <Days>
              <Day>Wednesday</Day>
              <Day>Friday</Day>
          </Days>
      </CourseCover>
  </CoverRequirements>
  <CourseOffRequests>
    <CourseOff >
      <CourseTypeID>00000</CourseTypeID>
      <TaID>0</TaID>
    </CourseOff>
    <CourseOff >
      <CourseTypeID>00001</CourseTypeID>
      <TaID>4</TaID>
    </CourseOff>
    <CourseOff >
      <CourseTypeID>00002</CourseTypeID>
      <TaID>5</TaID>
    </CourseOff>
    <CourseOff >
      <CourseTypeID>00003</CourseTypeID>
      <TaID>6</TaID>
    </CourseOff>
    <CourseOff >
      <CourseTypeID>00001</CourseTypeID>
      <TaID>7</TaID>
    </CourseOff>
    <CourseOff >
      <CourseTypeID>00004</CourseTypeID>
      <TaID>8</TaID>
    </CourseOff>
    <CourseOff >
      <CourseTypeID>00005</CourseTypeID>
      <TaID>9</TaID>
    </CourseOff>
    <CourseOff >
      <CourseTypeID>00002</CourseTypeID>
      <TaID>2</TaID>
    </CourseOff>
    <CourseOff >
      <CourseTypeID>00003</CourseTypeID>
      <TaID>3</TaID>
    </CourseOff>
  </CourseOffRequests>
  <CourseOnRequests>
      <CourseOn weight="1">
          <CourseTypeID>00001</CourseTypeID>
          <TaID>0</TaID>
    </CourseOn>
  </CourseOnRequests>
</SchedulingPeriod>
